id,client_name,rating,comment,created_at,is_verified
1,Анна Павлова,5,"Отличное предложение! Кофе вкусный, приятный бонус от ВТБ",2026-04-03 12:00:00,TRUE
2,Иван Сергеев,4,Очень понравилось обслуживание. Кофе был слегка остывший,2026-04-03 12:00:00,TRUE
3,Екатерина Дмитриева,5,"Хороший сервис, удобная система лояльности",2026-04-03 12:00:00,TRUE
4,Михаил Карасев,5,Быстрый Wi-Fi и тихое местечко,2026-04-03 12:00:00,TRUE
5,Ольга Волгина,4,Вкусно и недорого со скидкой. Иногда бывают очереди,2026-04-03 12:00:00,TRUE